{
  "schema_version": "plugin-host-oci-smoke-evidence/v1",
  "module_id": "MOD-PLUGIN-001",
  "image_ref": "masi-plugin-host:module-gates",
  "image_id": "sha256:2a8597985c6a7bf0d4ac7a82ce57d8f520a6739e26820912cbecf92243eb54b9",
  "source_revision": "78536cbd1e7df2710385aed0ab0063f1e0509d0d",
  "source_tree_digest": "sha256:965eae8ee05abed795deb0c6f8b5820e00bc12559fea18260e4776ec533eb868",
  "image_binary_digest": "sha256:736ed08f7793a7501691f95c37f29dcbf5365f48897bac72444a62a46292bc31",
  "local_release_binary_digest": "sha256:e58a772e95d76a651b1abd8e5559453ca0dd8e1d0942c43364768cde13a64a26",
  "release_binaries_share_exact_source_tree": true,
  "manager_leaf_digest": "sha256:e9e37e3aa6a21b79694a88b3b2b8250f8f678f506df8e5ceb6bf17bb0ca2059a",
  "runtime_profile": "plugin-runtime-host/v1",
  "wasmtime_version": "47.0.3",
  "non_root_user": "65532:65532",
  "read_only_rootfs": true,
  "capability_drop_all": true,
  "no_new_privileges": true,
  "tls13_only": true,
  "plaintext_rejected": true,
  "unauthorized_leaf_rejected": true,
  "startup_ready_live_metrics": true,
  "docker_semantic_healthcheck": true,
  "graceful_stop_seconds": 1,
  "actual_oci_started": true,
  "result": "PASS",
  "qualification": "NOT_QUALIFIED",
  "reason_code": "MODULE_OCI_BOUNDARY_VERIFIED"
}
