{
  "schema_version": "plugin-host-oci-smoke-evidence/v1",
  "module_id": "MOD-PLUGIN-001",
  "image_ref": "masi-plugin-host:module-gates",
  "image_id": "sha256:0074bfe81ff4bf01abe9bc20521bc8886cfb5e5bbefb97ff6ae338a8970dca3c",
  "source_revision": "78536cbd1e7df2710385aed0ab0063f1e0509d0d",
  "source_tree_digest": "sha256:c825d1937eed81c58c23e8f86ab048c072db917f896f59c69741cc503d4e74c5",
  "image_binary_digest": "sha256:ec15d5131638f4ce09dd4cbf03bcf7defdc313f5fa25ef1818776fb06ec0f455",
  "local_release_binary_digest": "sha256:4920aa357602f358cc02697bb0a252bc54963b28b8032ad703dfe5f2a81bdf35",
  "release_binaries_share_exact_source_tree": true,
  "manager_leaf_digest": "sha256:7da4e2f633ec857c6f1531d47d6b60609522997a141da579ce06a0c63dac307b",
  "runtime_profile": "plugin-runtime-host/v1",
  "wasmtime_version": "47.0.3",
  "non_root_user": "65532:65532",
  "read_only_rootfs": true,
  "capability_drop_all": true,
  "no_new_privileges": true,
  "tls13_only": true,
  "plaintext_rejected": true,
  "unauthorized_leaf_rejected": true,
  "startup_ready_live_metrics": true,
  "docker_semantic_healthcheck": true,
  "graceful_stop_seconds": 1,
  "actual_oci_started": true,
  "result": "PASS",
  "qualification": "NOT_QUALIFIED",
  "reason_code": "MODULE_OCI_BOUNDARY_VERIFIED"
}
